{
  "release_id": "REPLACE_BEFORE_FREEZE",
  "release_status": "DRAFT",
  "built_at": "2026-09-05T00:00:00+09:00",
  "freeze_at": "2026-09-05T00:00:00+09:00",
  "git_sha": "0000000000000000000000000000000000000000",
  "container_image_digest": "sha256:0000000000000000000000000000000000000000000000000000000000000000",
  "source_sha256": {
    "official_task_pdf": "3717441e091958b7214db710e0e4b9b8ae15ac6c205cad6e51721214798eb3de",
    "official_data_zip": "c3809aca73396f57242ded0188fa06a3d271bd4ad65010e53d5533efc7c18163"
  },
  "data_model_version": "REPLACE",
  "etl_version": "REPLACE",
  "serving_database_sha256": "0000000000000000000000000000000000000000000000000000000000000000",
  "metric_registry_sha256": "0000000000000000000000000000000000000000000000000000000000000000",
  "canonical_registry_sha256": "0000000000000000000000000000000000000000000000000000000000000000",
  "query_plan_schema_sha256": "0000000000000000000000000000000000000000000000000000000000000000",
  "planner_prompt_sha256": "0000000000000000000000000000000000000000000000000000000000000000",
  "hcx_runtime_schema_sha256": "0000000000000000000000000000000000000000000000000000000000000000",
  "evidence_bundle_schema_sha256": "0000000000000000000000000000000000000000000000000000000000000000",
  "etl_source_sha256": "0000000000000000000000000000000000000000000000000000000000000000",
  "application_source_sha256": "0000000000000000000000000000000000000000000000000000000000000000",
  "runtime_lock_sha256": "0000000000000000000000000000000000000000000000000000000000000000",
  "build_lock_sha256": "0000000000000000000000000000000000000000000000000000000000000000",
  "renderer_sha256": "0000000000000000000000000000000000000000000000000000000000000000",
  "safety_policy_sha256": "0000000000000000000000000000000000000000000000000000000000000000",
  "prompt_version": "REPLACE",
  "renderer_version": "REPLACE",
  "safety_policy_version": "REPLACE",
  "hcx_model_id": "TBD_AFTER_BRIEFING",
  "config_digest": "sha256:0000000000000000000000000000000000000000000000000000000000000000",
  "test_summary": {
    "passed": 0,
    "failed": 0,
    "skipped": 0,
    "report_sha256": "0000000000000000000000000000000000000000000000000000000000000000"
  },
  "post_freeze_policy": "NO_COMMIT_PUSH_DEPLOY_OR_ARTIFACT_CHANGES"
}
